Unnamed: 0,names,rates,director,actors
87,Caddyshack,7.3,Harold Ramis,"Chevy Chase, Rodney Dangerfield, Bill Murray, Ted Knight"
88,Spartacus: Blood and Sand,8.5,,"Andy Whitfield, Lucy Lawless, Manu Bennett, Daniel Feuerriegel"
89,You Should Have Left,5.3,David Koepp,"Kevin Bacon, Amanda Seyfried, Avery Tiiu Essex, Colin Blumenau"
90,Mad Max: Fury Road,8.1,George Miller,"Tom Hardy, Charlize Theron, Nicholas Hoult, Zoë Kravitz"
91,Upload,8.0,,"Robbie Amell, Andy Allo, Zainab Johnson, Kevin Bigley"
92,The Haunting of Hill House,8.7,,"Michiel Huisman, Carla Gugino, Henry Thomas, Elizabeth Reaser"
93,Justified,8.6,,"Timothy Olyphant, Nick Searcy, Joelle Carter, Jacob Pitts"
94,The Lighthouse,7.6,Robert Eggers,"Robert Pattinson, Willem Dafoe, Valeriia Karaman, Logan Hawkes"
95,The Lion King,6.9,Jon Favreau,"Donald Glover, Beyoncé, Seth Rogen, Chiwetel Ejiofor"
96,Space Force,6.8,,"Steve Carell, John Malkovich, Ben Schwartz, Diana Silvers"
97,House of Cards,8.7,,"Kevin Spacey, Michel Gill, Robin Wright, Kate Mara"
98,Broadchurch,8.4,,"David Tennant, Olivia Colman, Jodie Whittaker, Andrew Buchan"
99,The Legend of Korra,8.4,,"Janet Varney, P.J. Byrne, David Faustino, J.K. Simmons"
100,Bombshell,6.8,Jay Roach,"Charlize Theron, Nicole Kidman, Margot Robbie, John Lithgow"
101,Pitch Perfect,7.2,Jason Moore,"Anna Kendrick, Brittany Snow, Rebel Wilson, Anna Camp"
102,Arrested Development,8.7,,"Jason Bateman, Michael Cera, Portia de Rossi, Will Arnett"
103,Penny Dreadful: City of Angels,6.1,,"Natalie Dormer, Daniel Zovatto, Kerry Bishé, Adriana Barraza"
104,Ready Player One,7.5,Steven Spielberg,"Tye Sheridan, Olivia Cooke, Ben Mendelsohn, Lena Waithe"
105,Animal Kingdom,8.2,,"Shawn Hatosy, Ben Robson, Jake Weary, Finn Cole"
106,True Blood,7.8,,"Anna Paquin, Stephen Moyer, Sam Trammell, Ryan Kwanten"
107,Guddoferozu,8.7,Martin Scorsese,"Robert De Niro, Ray Liotta, Joe Pesci, Lorraine Bracco"
108,Inglourious Basterds,8.3,Quentin Tarantino,"Brad Pitt, Diane Kruger, Eli Roth, Mélanie Laurent"
109,Puresutêji,8.5,Christopher Nolan,"Christian Bale, Hugh Jackman, Scarlett Johansson, Michael Caine"
110,Guns Akimbo,6.3,Jason Lei Howden,"Samara Weaving, Daniel Radcliffe, Rhys Darby, Ned Dennehy"
111,Tell Me a Story,7.2,,"Danielle Campbell, Paul Wesley, James Wolk, Billy Magnussen"
112,Young Superman,7.5,,"Tom Welling, Michael Rosenbaum, Allison Mack, Kristin Kreuk"
113,Watchmen,7.6,Zack Snyder,"Jackie Earle Haley, Patrick Wilson, Carla Gugino, Malin Akerman"
114,Star Trek: Discovery,7.3,,"Sonequa Martin-Green, Doug Jones, Anthony Rapp, Mary Wiseman"
115,Motherland: Fort Salem,7.1,,"Taylor Hickson, Amalia Holm, Demetria McKinney, Jessica Sutton"
116,Supergirl,6.3,,"Melissa Benoist, Chyler Leigh, David Harewood, Mehcad Brooks"
117,Bad Education,7.1,Cory Finley,"Hugh Jackman, Ray Romano, Welker White, Allison Janney"
118,A Suitable Boy,5.6,,"Tanya Maniktala, Ishaan Khattar, Vivek Gomber, Shubham Saraf"
119,Gurîn Mairu,8.6,Frank Darabont,"Tom Hanks, Michael Clarke Duncan, David Morse, Bonnie Hunt"
120,Fatal Affair,4.4,Peter Sullivan,"Nia Long, Omar Epps, Stephen Bishop, Aubrey Cleland"
121,Top Gun: Maverick,,Joseph Kosinski,"Tom Cruise, Jennifer Connelly, Val Kilmer, Jon Hamm"
122,Pairêtsu Obu Karibian: Saigo no Kaizoku,6.6,,"Johnny Depp, Geoffrey Rush, Javier Bardem, Orlando Bloom"
123,Family Guy,8.1,,"Seth MacFarlane, Alex Borstein, Seth Green, Mila Kunis"
124,Perry Mason,8.2,,"Raymond Burr, Barbara Hale, William Hopper, Ray Collins"
125,The Act,8.0,,"Patricia Arquette, Joey King, AnnaSophia Robb, Chloë Sevigny"
126,Hereditary,7.3,Ari Aster,"Toni Collette, Milly Shapiro, Gabriel Byrne, Alex Wolff"
127,The Americans,8.4,,"Keri Russell, Matthew Rhys, Keidrich Sellati, Holly Taylor"
128,Becky,5.7,,"Lulu Wilson, Kevin James, Joel McHale, Robert Maillet"
129,How Do You Know,5.4,James L. Brooks,"Reese Witherspoon, Paul Rudd, Owen Wilson, Jack Nicholson"
130,Matorikkusu,8.7,,"Keanu Reeves, Laurence Fishburne, Carrie-Anne Moss, Hugo Weaving"
131,Little House on the Prairie,7.4,,"Melissa Gilbert, Michael Landon, Karen Grassle, Rachel Lindsay Greenbush"
132,Aquaman,7.0,James Wan,"Jason Momoa, Amber Heard, Willem Dafoe, Patrick Wilson"
133,Star Wars: The Clone Wars,8.2,,"Tom Kane, Dee Bradley Baker, Matt Lanter, James Arnold Taylor"
134,Project Power,,,"Jamie Foxx, Joseph Gordon-Levitt, Dominique Fishback, Rodrigo Santoro"
135,Avengers: Infinity War,8.4,,"Robert Downey Jr., Chris Hemsworth, Mark Ruffalo, Chris Evans"
136,The Goonies,7.8,Richard Donner,"Sean Astin, Josh Brolin, Jeff Cohen, Corey Feldman"
137,Bill & Ted's Excellent Adventure,6.9,Stephen Herek,"Keanu Reeves, Alex Winter, George Carlin, Terry Camilleri"
138,Legends of Tomorrow,6.8,,"Caity Lotz, Amy Louise Pemberton, Dominic Purcell, Brandon Routh"
139,Fight Club,8.8,David Fincher,"Brad Pitt, Edward Norton, Meat Loaf, Zach Grenier"
140,Star Trek: Voyager,7.8,,"Kate Mulgrew, Robert Beltran, Roxann Dawson, Robert Duncan McNeill"
141,Titans,7.8,,"Brenton Thwaites, Teagan Croft, Anna Diop, Ryan Potter"
142,Dâku naito raijingu,8.4,Christopher Nolan,"Christian Bale, Tom Hardy, Anne Hathaway, Gary Oldman"
143,Schindler's List,8.9,Steven Spielberg,"Liam Neeson, Ralph Fiennes, Ben Kingsley, Caroline Goodall"
144,Black Widow,,Cate Shortland,"Florence Pugh, Scarlett Johansson, Robert Downey Jr., Rachel Weisz"
145,Forrest Gump,8.8,Robert Zemeckis,"Tom Hanks, Robin Wright, Gary Sinise, Sally Field"
146,Larry no mid life crisis,8.7,,"Larry David, Cheryl Hines, Jeff Garlin, Susie Essman"
147,Star Trek,8.3,,"William Shatner, Leonard Nimoy, DeForest Kelley, Nichelle Nichols"
148,Big Little Lies,8.5,,"Reese Witherspoon, Nicole Kidman, Shailene Woodley, Zoë Kravitz"
149,Hunters,7.2,,"Al Pacino, Logan Lerman, Lena Olin, Jerrika Hinton"
150,The Chi,7.5,,"Jason Mitchell, Jacob Latimore, Ntare Guma Mbaho Mwine, Alex R. Hibbert"
151,The Wrong Missy,5.7,Tyler Spindel,"David Spade, Lauren Lapkus, Nick Swardson, Geoff Pierson"
152,CSI: Kagaku sôsa han,7.6,,"Laurence Fishburne, Marg Helgenberger, George Eads, Eric Szmanda"
153,2001 nen: Uchuu no Tabi,8.3,Stanley Kubrick,"Keir Dullea, Gary Lockwood, William Sylvester, Daniel Richter"
154,Castle,8.1,,"Nathan Fillion, Stana Katic, Susan Sullivan, Jon Huertas"
155,Dipâteddo,8.5,Martin Scorsese,"Leonardo DiCaprio, Matt Damon, Jack Nicholson, Mark Wahlberg"
156,It,7.3,Andy Muschietti,"Bill Skarsgård, Jaeden Martell, Finn Wolfhard, Sophia Lillis"
157,South Park,8.7,,"Trey Parker, Matt Stone, Isaac Hayes, Mona Marshall"
158,Justice League,6.3,Zack Snyder,"Ben Affleck, Gal Gadot, Jason Momoa, Ezra Miller"
159,6 Underground,6.1,Michael Bay,"Ryan Reynolds, Mélanie Laurent, Manuel Garcia-Rulfo, Ben Hardy"
160,Summerland,6.5,Jessica Swale,"Gemma Arterton, Gugu Mbatha-Raw, Penelope Wilton, Tom Courtenay"
161,The Man in the High Castle,8.0,,"Alexa Davalos, Luke Kleintank, Rufus Sewell, Rupert Evans"
162,Hustlers,6.3,Lorene Scafaria,"Constance Wu, Jennifer Lopez, Julia Stiles, Mette Towley"
163,Fleabag,8.7,,"Phoebe Waller-Bridge, Sian Clifford, Olivia Colman, Jenny Rainsford"
164,Alias,7.6,,"Jennifer Garner, Ron Rifkin, Carl Lumbly, Kevin Weisman"
165,Twin Peaks,8.8,,"Kyle MacLachlan, Michael Ontkean, Mädchen Amick, Dana Ashbrook"
166,Guardians of the Galaxy,8.0,James Gunn,"Chris Pratt, Vin Diesel, Bradley Cooper, Zoe Saldana"
167,Mission: Impossible - Fallout,7.7,Christopher McQuarrie,"Tom Cruise, Henry Cavill, Ving Rhames, Simon Pegg"
168,The Princess Bride,8.1,Rob Reiner,"Cary Elwes, Mandy Patinkin, Robin Wright, Chris Sarandon"
169,Princess Bride,8.1,,"Rob Reiner, Diego Luna, Jack Black, Thomas Lennon"
170,Archer,8.6,,"H. Jon Benjamin, Judy Greer, Amber Nash, Chris Parnell"
171,NOS4A2,6.7,,"Ashleigh Cummings, Ólafur Darri Ólafsson, Jahkara Smith, Ebon Moss-Bachrach"
172,The Assistant,6.1,Kitty Green,"Julia Garner, Owen Holland, Jon Orsini, Rory Kulz"
173,Shameless,8.0,,"David Threlfall, Rebecca Atkinson, Alice Barry, Nicky Evans"
174,Daredevil,8.6,,"Charlie Cox, Vincent D'Onofrio, Deborah Ann Woll, Elden Henson"
175,Kimi ni yomu monogatari,7.8,Nick Cassavetes,"Gena Rowlands, James Garner, Rachel McAdams, Ryan Gosling"
176,Good Boys,6.7,Gene Stupnitsky,"Jacob Tremblay, Keith L. Williams, Brady Noon, Molly Gordon"
177,The Firm,6.8,Sydney Pollack,"Tom Cruise, Jeanne Tripplehorn, Gene Hackman, Hal Holbrook"
178,Guardians of the Galaxy Vol. 2,7.6,James Gunn,"Chris Pratt, Zoe Saldana, Dave Bautista, Vin Diesel"
179,Pirates of the Caribbean: The Curse of the Black Pearl,8.0,Gore Verbinski,"Johnny Depp, Geoffrey Rush, Orlando Bloom, Keira Knightley"
180,Spider-Man: Into the Spider-Verse,8.4,,"Shameik Moore, Jake Johnson, Hailee Steinfeld, Mahershala Ali"
181,Zodiac,7.7,David Fincher,"Jake Gyllenhaal, Robert Downey Jr., Mark Ruffalo, Anthony Edwards"
182,Nô kantorî,8.1,,"Tommy Lee Jones, Javier Bardem, Josh Brolin, Woody Harrelson"
183,Mighty Thor: Battle Royale,7.9,Taika Waititi,"Chris Hemsworth, Tom Hiddleston, Cate Blanchett, Mark Ruffalo"
184,Gone Girl,8.1,David Fincher,"Ben Affleck, Rosamund Pike, Neil Patrick Harris, Tyler Perry"
185,Altered Carbon,8.1,,"Chris Conner, Renée Elise Goldsberry, Will Yun Lee, Dichen Lachman"
186,Columbo,8.2,,"Peter Falk, Mike Lally, John Finnegan, Bruce Kirby"
187,Shin kansen: Fainaru ekusupuresu,7.6,Sang-ho Yeon,"Yoo Gong, Yu-mi Jung, Dong-seok Ma, Su-an Kim"
188,Jozu,8.0,Steven Spielberg,"Roy Scheider, Robert Shaw, Richard Dreyfuss, Lorraine Gary"
189,Rizzoli & Isles,7.6,,"Angie Harmon, Sasha Alexander, Jordan Bridges, Bruce McGill"
190,Biggu ribousuki,8.1,,"Jeff Bridges, John Goodman, Julianne Moore, Steve Buscemi"
191,Django Tsunagarezaru Mono,8.4,Quentin Tarantino,"Jamie Foxx, Christoph Waltz, Leonardo DiCaprio, Kerry Washington"
192,John Wick,7.4,,"Keanu Reeves, Michael Nyqvist, Alfie Allen, Willem Dafoe"
193,Lootcase,7.9,Rajesh Krishnan,"Kunal Khemu, Rasika Dugal, Gajraj Rao, Vijay Raaz"
194,Léon,8.5,Luc Besson,"Jean Reno, Gary Oldman, Natalie Portman, Danny Aiello"
195,The Punisher,8.5,,"Jon Bernthal, Amber Rose Revah, Ben Barnes, Jason R. Moore"
196,Harî Pottâ to shi no hihô: Part 2,8.1,David Yates,"Daniel Radcliffe, Emma Watson, Rupert Grint, Michael Gambon"
197,Catch Me If You Can,8.1,Steven Spielberg,"Leonardo DiCaprio, Tom Hanks, Christopher Walken, Martin Sheen"
198,Abatâ,7.8,James Cameron,"Sam Worthington, Zoe Saldana, Sigourney Weaver, Michelle Rodriguez"
199,My Spy,6.3,Peter Segal,"Dave Bautista, Chloe Coleman, Parisa Fitz-Henley, Kristen Schaal"
0,Portrait de la jeune fille en feu,8.1,Céline Sciamma,"Noémie Merlant, Adèle Haenel, Luàna Bajrami, Valeria Golino"
1,Sebun,8.6,David Fincher,"Morgan Freeman, Brad Pitt, Kevin Spacey, Andrew Kevin Walker"
2,The Greatest Showman,7.6,Michael Gracey,"Hugh Jackman, Michelle Williams, Zac Efron, Zendaya"
3,Zombieland: Double Tap,6.7,Ruben Fleischer,"Woody Harrelson, Jesse Eisenberg, Emma Stone, Abigail Breslin"
4,Harî Pottâ to honoo no goburetto,7.7,Mike Newell,"Daniel Radcliffe, Emma Watson, Rupert Grint, Eric Sykes"
5,Munich,7.5,Steven Spielberg,"Eric Bana, Daniel Craig, Marie-Josée Croze, Ciarán Hinds"
6,Longmire,8.3,,"Robert Taylor, Katee Sackhoff, Lou Diamond Phillips, Cassidy Freeman"
7,Gemini Man,5.7,Ang Lee,"Will Smith, Mary Elizabeth Winstead, Clive Owen, Benedict Wong"
8,Rocketman,7.3,Dexter Fletcher,"Taron Egerton, Jamie Bell, Richard Madden, Bryce Dallas Howard"
9,Besuto kiddo,7.2,John G. Avildsen,"Ralph Macchio, Pat Morita, Elisabeth Shue, Martin Kove"
10,Deadpool,8.0,Tim Miller,"Ryan Reynolds, Morena Baccarin, T.J. Miller, Ed Skrein"
11,Banshee,8.4,,"Antony Starr, Ivana Milicevic, Ulrich Thomsen, Frankie Faison"
12,Emma.,6.7,Autumn de Wilde,"Anya Taylor-Joy, Johnny Flynn, Mia Goth, Angus Imrie"
13,Marcella,7.4,,"Anna Friel, Ray Panthaki, Jack Doolan, Jamie Bamber"
14,NCIS: Los Angeles,6.7,,"Chris O'Donnell, Daniela Ruah, Barrett Foa, Linda Hunt"
15,Banana Split,6.2,Benjamin Kasulke,"Hannah Marks, Liana Liberato, Dylan Sprouse, Luke Spencer Roberts"
16,The Baby-Sitters Club,7.4,,"Sophie Grace, Momona Tamada, Shay Rudolph, Malia Baker"
17,How to Build a Girl,5.8,Coky Giedroyc,"Beanie Feldstein, Cleo, Dónal Finn, Paddy Considine"
18,Porutagaisuto,7.3,Tobe Hooper,"JoBeth Williams, Heather O'Rourke, Craig T. Nelson, Beatrice Straight"
19,Harriet,6.5,Kasi Lemmons,"Cynthia Erivo, Janelle Monáe, Leslie Odom Jr., Joe Alwyn"
20,Love on the Spectrum,8.7,,
21,The Hunger Games,7.2,Gary Ross,"Jennifer Lawrence, Josh Hutcherson, Liam Hemsworth, Stanley Tucci"
22,Charmed,7.1,,"Holly Marie Combs, Alyssa Milano, Brian Krause, Rose McGowan"
23,Alien,8.4,Ridley Scott,"Sigourney Weaver, Tom Skerritt, John Hurt, Veronica Cartwright"
24,Rogue,,M.J. Bassett,"Megan Fox, Jessica Sutton, Calli Taylor, Philip Winchester"
25,Bob's Burgers,8.1,,"H. Jon Benjamin, Dan Mintz, Eugene Mirman, John Roberts"
26,Bloodline,8.0,,"Kyle Chandler, Ben Mendelsohn, Linda Cardellini, Sissy Spacek"
27,Friday Night Lights,8.6,,"Kyle Chandler, Connie Britton, Zach Gilford, Aimee Teegarden"
28,Supaidâman: Fâ Furomu Hômu,7.5,Jon Watts,"Tom Holland, Samuel L. Jackson, Jake Gyllenhaal, Marisa Tomei"
29,Indian Matchmaking,6.0,,"Sima Taparia, Vyasar M. Ganesan, Ankita Bansal, Nadia Jagessar"
30,Desuparêto na tsuma tachi,7.4,,"Teri Hatcher, Felicity Huffman, Marcia Cross, Eva Longoria"
31,The Fault in Our Stars,7.7,Josh Boone,"Shailene Woodley, Ansel Elgort, Nat Wolff, Laura Dern"
32,Black Panther,7.3,Ryan Coogler,"Chadwick Boseman, Michael B. Jordan, Lupita Nyong'o, Danai Gurira"
33,Alita: Battle Angel,7.3,Robert Rodriguez,"Rosa Salazar, Christoph Waltz, Jennifer Connelly, Mahershala Ali"
34,Blue Bloods,7.6,,"Donnie Wahlberg, Bridget Moynahan, Will Estes, Len Cariou"
35,Fantastic Beasts: The Crimes of Grindelwald,6.6,David Yates,"Eddie Redmayne, Katherine Waterston, Dan Fogler, Johnny Depp"
36,Dynasty,7.3,,"Elizabeth Gillies, Rafael de la Fuente, Robert Christopher Riley, Sam Adegoke"
37,Swallow,6.4,Carlo Mirabella-Davis,"Haley Bennett, Austin Stowell, Denis O'Hare, Elizabeth Marvel"
38,The Leftovers,8.3,,"Justin Theroux, Amy Brenneman, Christopher Eccleston, Liv Tyler"
39,Onward,7.4,Dan Scanlon,"Tom Holland, Chris Pratt, Julia Louis-Dreyfus, Octavia Spencer"
40,Fringe,8.4,,"Anna Torv, Joshua Jackson, John Noble, Jasika Nicole"
41,Almost Famous,7.9,Cameron Crowe,"Billy Crudup, Patrick Fugit, Kate Hudson, Frances McDormand"
42,Kimi no namae de Boku wo yonde,7.9,Luca Guadagnino,"Armie Hammer, Timothée Chalamet, Michael Stuhlbarg, Amira Casar"
43,Suicide Squad,6.0,David Ayer,"Will Smith, Jared Leto, Margot Robbie, Viola Davis"
44,"Murder, She Wrote",7.0,,"Angela Lansbury, William Windom, Ron Masak, Louis Herthum"
45,See,7.6,,"Jason Momoa, Sylvia Hoeks, Hera Hilmar, Christian Camargo"
46,Black Sails,8.2,,"Jessica Parker Kennedy, Toby Stephens, Hannah New, Zach McGowan"
47,Jane the Virgin,7.8,,"Gina Rodriguez, Andrea Navedo, Yael Grobglas, Ivonne Coll"
48,Jigoku no mokushiroku,8.4,Francis Ford Coppola,"Martin Sheen, Marlon Brando, Robert Duvall, Frederic Forrest"
49,Eabendâ,4.1,M. Night Shyamalan,"Noah Ringer, Nicola Peltz, Jackson Rathbone, Dev Patel"
50,Kakkou no su no ue de,8.7,Milos Forman,"Jack Nicholson, Louise Fletcher, Will Sampson, Michael Berryman"
51,Fantasy Island,4.9,Jeff Wadlow,"Michael Peña, Maggie Q, Lucy Hale, Austin Stowell"
52,Dunkirk,7.9,Christopher Nolan,"Fionn Whitehead, Barry Keoghan, Mark Rylance, Tom Hardy"
53,Scarface,8.3,Brian De Palma,"Al Pacino, Michelle Pfeiffer, Steven Bauer, Mary Elizabeth Mastrantonio"
54,Baywatch,5.3,,"David Hasselhoff, Pamela Anderson, Yasmine Bleeth, Jeremy Jackson"
55,American Pie,7.0,,"Jason Biggs, Chris Klein, Thomas Ian Nicholas, Jennifer Coolidge"
56,Furaingu Hai,7.7,,"Robert Hays, Julie Hagerty, Leslie Nielsen, Kareem Abdul-Jabbar"
57,Deadpool 2,7.7,David Leitch,"Ryan Reynolds, Josh Brolin, Morena Baccarin, Julian Dennison"
58,Sutashippu to~urupazu,7.2,Paul Verhoeven,"Casper Van Dien, Denise Richards, Dina Meyer, Jake Busey"
59,Omerta,7.2,Hansal Mehta,"Rajkummar Rao, Rajesh Tailang, Satwant Kaur, Blake Allan"
60,Arajin,7.0,Guy Ritchie,"Will Smith, Mena Massoud, Naomi Scott, Marwan Kenzari"
61,Monk,8.0,,"Tony Shalhoub, Jason Gray-Stanford, Ted Levine, Traylor Howard"
62,Her,8.0,Spike Jonze,"Joaquin Phoenix, Amy Adams, Scarlett Johansson, Rooney Mara"
63,Baby Driver,7.6,Edgar Wright,"Ansel Elgort, Jon Bernthal, Jon Hamm, Eiza González"
64,Captain Marvel,6.9,,"Brie Larson, Samuel L. Jackson, Ben Mendelsohn, Jude Law"
65,Znaki,6.2,,"Andrzej Konopka, Helena Sujecka, Magdalena Zak, Michal Czernecki"
66,Grease,7.2,Randal Kleiser,"John Travolta, Olivia Newton-John, Stockard Channing, Jeff Conaway"
67,Feel the Beat,6.3,Elissa Down,"Sofia Carson, Pamela MacDonald, Sonia Laplante, Nayo"
68,Taxi Driver,8.3,Martin Scorsese,"Robert De Niro, Jodie Foster, Cybill Shepherd, Albert Brooks"
69,Get Out,7.7,Jordan Peele,"Daniel Kaluuya, Allison Williams, Bradley Whitford, Catherine Keener"
70,Boku no hîrô akademia,8.5,,"Daiki Yamashita, Justin Briner, Nobuhiko Okamoto, Ayane Sakura"
71,30 Rock,8.2,,"Tina Fey, Alec Baldwin, Tracy Morgan, Jack McBrayer"
72,Stand by Me,8.1,Rob Reiner,"Wil Wheaton, River Phoenix, Corey Feldman, Jerry O'Connell"
73,Ghosts of War,5.4,Eric Bress,"Brenton Thwaites, Theo Rossi, Kyle Gallner, Skylar Astin"
74,Room,8.1,Lenny Abrahamson,"Brie Larson, Jacob Tremblay, Sean Bridgers, Wendy Crewson"
75,Devil's Gate,5.1,Clay Staub,"Amanda Schull, Shawn Ashmore, Milo Ventimiglia, Bridget Regan"
76,Luther,8.5,,"Idris Elba, Dermot Crowley, Michael Smiley, Warren Brown"
77,Sonikku za mûbî,6.6,Jeff Fowler,"Ben Schwartz, James Marsden, Jim Carrey, Tika Sumpter"
78,Zoku yuuhi no ganman,8.8,Sergio Leone,"Clint Eastwood, Eli Wallach, Lee Van Cleef, Aldo Giuffrè"
79,Élite,7.6,,"Itzan Escamilla, Miguel Bernardeau, Arón Piper, Omar Ayuso"
80,Room 104,6.1,,"Jennifer Lafleur, Jon Bass, Jenny Leonhardt, Michael Chandler"
81,El guardián invisible,6.4,Fernando González Molina,"Marta Etura, Elvira Mínguez, Nene, Francesc Orella"
82,The Land Unknown,5.7,Virgil W. Vogel,"Jock Mahoney, Shirley Patterson, William Reynolds, Henry Brandon"
83,Stargate SG-1,8.4,,"Richard Dean Anderson, Michael Shanks, Amanda Tapping, Christopher Judge"
84,Bloodshot,5.7,Dave Wilson,"Vin Diesel, Eiza González, Sam Heughan, Toby Kebbell"
85,The Usual Suspects,8.5,Bryan Singer,"Kevin Spacey, Gabriel Byrne, Chazz Palminteri, Stephen Baldwin"
86,9-1-1,7.7,,"Angela Bassett, Peter Krause, Oliver Stark, Aisha Hinds"
87,Sutâ wôzu episoddo 1: Fantomu menasu,6.5,George Lucas,"Ewan McGregor, Liam Neeson, Natalie Portman, Jake Lloyd"
88,Star Trek: Picard,7.6,,"Patrick Stewart, Alison Pill, Isa Briones, Michelle Hurd"
89,Top Gun,6.9,Tony Scott,"Tom Cruise, Tim Robbins, Kelly McGillis, Val Kilmer"
90,Poirot,8.6,,"David Suchet, Hugh Fraser, Philip Jackson, Pauline Moran"
91,El hoyo,7.0,Galder Gaztelu-Urrutia,"Ivan Massagué, Zorion Eguileor, Antonia San Juan, Emilio Buale"
92,Married with Children,8.0,,"Ed O'Neill, Christina Applegate, Katey Sagal, Amanda Bearse"
93,White Collar,8.2,,"Matt Bomer, Tim DeKay, Willie Garson, Tiffani Thiessen"
94,Gojira tai Kingu Kongu,,Adam Wingard,"Millie Bobby Brown, Eiza González, Alexander Skarsgård, Rebecca Hall"
95,Sicario,7.6,Denis Villeneuve,"Emily Blunt, Josh Brolin, Benicio Del Toro, Jon Bernthal"
96,The Goldbergs,8.1,,"Wendi McLendon-Covey, Sean Giambrone, Troy Gentile, Hayley Orrantia"
97,Artemis Fowl,4.1,Kenneth Branagh,"Ferdia Shaw, Lara McDonnell, Josh Gad, Tamara Smart"
98,The Lodge,6.0,,"Riley Keough, Jaeden Martell, Lia McHugh, Richard Armitage"
99,Puraibeto Raian,8.6,Steven Spielberg,"Tom Hanks, Matt Damon, Tom Sizemore, Edward Burns"
100,A Simple Favor,6.8,Paul Feig,"Anna Kendrick, Blake Lively, Henry Golding, Andrew Rannells"
101,Murdoch Mysteries,8.1,,"Yannick Bisson, Helene Joy, Thomas Craig, Jonny Harris"
102,Bohemian Rhapsody,8.0,Bryan Singer,"Rami Malek, Lucy Boynton, Gwilym Lee, Ben Hardy"
103,An American Pickle,5.8,Brandon Trost,"Seth Rogen, Sarah Snook, Molly Evensen, Eliot Glazer"
104,Mom,7.2,,"Anna Faris, Allison Janney, Mimi Kennedy, Beth Hall"
105,Vis a vis,8.3,,"Alba Flores, María Isabel Díaz Lago, Marta Aledo, Najwa Nimri"
106,The Vast of Night,6.7,Andrew Patterson,"Sierra McCormick, Jake Horowitz, Gail Cronauer, Bruce Davis"
107,Dirty John,7.2,,"Connie Britton, Christian Slater, Eric Bana, Amanda Peet"
108,Chuck,8.2,,"Zachary Levi, Yvonne Strahovski, Joshua Gomez, Vik Sahay"
109,Venom,6.7,Ruben Fleischer,"Tom Hardy, Michelle Williams, Riz Ahmed, Scott Haze"
110,Last Christmas,6.5,Paul Feig,"Madison Ingoldsby, Emma Thompson, Boris Isakovic, Lucy Miller"
111,Honoo 628,8.3,Elem Klimov,"Aleksey Kravchenko, Olga Mironova, Liubomiras Laucevicius, Vladas Bagdonas"
112,Teenage Bounty Hunters,,,"Maddie Phillips, Anjelica Bette Fellini, Kadeem Hardison, Virginia Williams"
113,Malcolm in the Middle,8.0,,"Frankie Muniz, Bryan Cranston, Justin Berfield, Erik Per Sullivan"
114,Frasier,8.0,,"Kelsey Grammer, Jane Leeves, David Hyde Pierce, Peri Gilpin"
115,Dark Phoenix,5.8,Simon Kinberg,"James McAvoy, Michael Fassbender, Jennifer Lawrence, Nicholas Hoult"
116,Virgin River,7.5,,"Colin Lawrence, Benjamin Hollingsworth, Grayson Maxwell Gurnsey, Martin Henderson"
117,The Twilight Zone,5.8,,"Jordan Peele, David Epstein, Kelly Ann Woods, Mark Silverman"
118,Boardwalk Empire,8.5,,"Steve Buscemi, Kelly Macdonald, Michael Shannon, Shea Whigham"
119,Sukinzu,8.2,,"Kaya Scodelario, Nicholas Hoult, Joe Dempsie, Hannah Murray"
120,Dazed and Confused,7.6,Richard Linklater,"Jason London, Wiley Wiggins, Matthew McConaughey, Rory Cochrane"
121,De Twaalf,7.5,,"Luc De Ruelle, Maaike Neuville, Tom Vermeir, Peter Gorissen"
122,Police Academy,6.7,Hugh Wilson,"Steve Guttenberg, G.W. Bailey, Kim Cattrall, Bubba Smith"
123,The Matrix 4,,Lana Wachowski,"Jonathan Groff, Keanu Reeves, Carrie-Anne Moss, Priyanka Chopra"
124,Erumu gai no akumu,7.5,Wes Craven,"Heather Langenkamp, Johnny Depp, Robert Englund, John Saxon"
125,Da 5 Bloods,6.5,Spike Lee,"Delroy Lindo, Jonathan Majors, Clarke Peters, Norm Lewis"
126,Purizunâzu,8.1,Denis Villeneuve,"Hugh Jackman, Jake Gyllenhaal, Viola Davis, Melissa Leo"
127,Memento,8.4,Christopher Nolan,"Guy Pearce, Carrie-Anne Moss, Joe Pantoliano, Mark Boone Junior"
128,Star Wars,8.6,George Lucas,"Mark Hamill, Harrison Ford, Carrie Fisher, Alec Guinness"
129,The Golden Girls,7.9,,"Bea Arthur, Betty White, Rue McClanahan, Estelle Getty"
130,Love Life,7.4,,"Anna Kendrick, Zoe Chao, Peter Vack, Sasha Compère"
131,Legacy of Lies,4.9,Adrian Bol,"Scott Adkins, Honor Kneafsey, Andrea Vasiliou, Yuliia Sobol"
132,Rogue One: Star Wars Story,7.8,Gareth Edwards,"Felicity Jones, Diego Luna, Alan Tudyk, Donnie Yen"
133,Batman Begins,8.2,Christopher Nolan,"Christian Bale, Michael Caine, Ken Watanabe, Liam Neeson"
134,Kyaputan Amerika: Za fâsuto Abenjâ,6.9,Joe Johnston,"Chris Evans, Hugo Weaving, Samuel L. Jackson, Hayley Atwell"
135,The Devil's Advocate,7.5,Taylor Hackford,"Keanu Reeves, Al Pacino, Charlize Theron, Jeffrey Jones"
136,Green Book,8.2,Peter Farrelly,"Viggo Mortensen, Mahershala Ali, Linda Cardellini, Sebastian Maniscalco"
137,Fast & Furious Presents: Hobbs & Shaw,6.4,David Leitch,"Dwayne Johnson, Jason Statham, Idris Elba, Vanessa Kirby"
138,Sing,7.1,Garth Jennings,"Matthew McConaughey, Reese Witherspoon, Seth MacFarlane, Scarlett Johansson"
139,Constantine,7.0,Francis Lawrence,"Keanu Reeves, Rachel Weisz, Djimon Hounsou, Shia LaBeouf"
140,Grown Ups 2,5.4,Dennis Dugan,"Adam Sandler, Kevin James, Chris Rock, David Spade"
141,Ray Donovan,8.3,,"Liev Schreiber, Eddie Marsan, Dash Mihok, Pooch Hall"
142,The Breakfast Club,7.9,John Hughes,"Emilio Estevez, Judd Nelson, Molly Ringwald, Ally Sheedy"
143,First Cow,7.1,Kelly Reichardt,"Alia Shawkat, John Magaro, Dylan Smith, Ryan Findley"
144,The Adventures of Sharkboy and Lavagirl 3-D,3.5,Robert Rodriguez,"Cayden Boyd, George Lopez, Kristin Davis, David Arquette"
145,Pose,8.6,,"Mj Rodriguez, Dominique Jackson, Indya Moore, Angel Bismark Curiel"
146,Carnival Row,7.9,,"Orlando Bloom, Cara Delevingne, Simon McBurney, Tamzin Merchant"
147,Rôdo obu za ringu - Ô no kikan,8.9,Peter Jackson,"Elijah Wood, Viggo Mortensen, Ian McKellen, Orlando Bloom"
148,Chemical Hearts,,Richard Tanne,"Lili Reinhart, Austin Abrams, Sarah Jones, Kara Young"
149,I See You,6.8,Adam Randall,"Helen Hunt, Jon Tenney, Judah Lewis, Owen Teague"
150,The Tudors,8.1,,"Jonathan Rhys Meyers, Henry Cavill, Anthony Brophy, James Frain"
151,After Life,8.5,,"Ricky Gervais, Tom Basden, Tony Way, Diane Morgan"
152,Deep Blue,5.9,Renny Harlin,"Thomas Jane, Saffron Burrows, Samuel L. Jackson, Jacqueline McKenzie"
153,Letterkenny,8.7,,"Jared Keeso, Michelle Mylett, Nathan Dales, K. Trevor Wilson"
154,Tokei Jikake no Orenji,8.3,Stanley Kubrick,"Malcolm McDowell, Patrick Magee, Michael Bates, Warren Clarke"
155,7500,6.3,Patrick Vollrath,"Joseph Gordon-Levitt, Omid Memar, Aylin Tezel, Carlo Kitzlinger"
156,Veronica Mars,8.3,,"Kristen Bell, Jason Dohring, Enrico Colantoni, Percy Daggs III"
157,Eyes Wide Shut,7.4,Stanley Kubrick,"Tom Cruise, Nicole Kidman, Todd Field, Sydney Pollack"
158,Boy Meets World,8.1,,"Ben Savage, Rider Strong, William Daniels, Betsy Randle"
159,The Orville,8.0,,"Seth MacFarlane, Adrianne Palicki, Penny Johnson Jerald, Scott Grimes"
160,Za taun,7.5,Ben Affleck,"Ben Affleck, Rebecca Hall, Jon Hamm, Jeremy Renner"
161,Double Jeopardy,6.5,Bruce Beresford,"Ashley Judd, Tommy Lee Jones, Bruce Greenwood, Benjamin Weir"
162,Utopia,,,"Desmin Borges, Dan Byrd, John Cusack, Christopher Denham"
163,Harii Pottâ to Azukaban no shûjin,7.9,Alfonso Cuarón,"Daniel Radcliffe, Emma Watson, Rupert Grint, Richard Griffiths"
164,Ava,5.7,Tate Taylor,"Jessica Chastain, Colin Farrell, Geena Davis, John Malkovich"
165,X-Men: Fyûchâ & pasuto,8.0,Bryan Singer,"Patrick Stewart, Ian McKellen, Hugh Jackman, James McAvoy"
166,Shutter Island,8.2,Martin Scorsese,"Leonardo DiCaprio, Emily Mortimer, Mark Ruffalo, Ben Kingsley"
167,Dune,6.5,David Lynch,"Kyle MacLachlan, Virginia Madsen, Francesca Annis, Leonardo Cimino"
